Investor name,Website,Global HQ,Investment thesis,Investor type,Preferred Stages,Cheque Min,Cheque Max
9Unicorns,https://www.9unicorns.in/,"Mittal Commercia, Sakinaka, Hasan Pada Rd, Mittal Industrial Estate, Marol, Andheri East, 203-206, Mumbai, Maharashtra 400059, IN",We invest in early stage startups across all sectors. The fund will operate uniquely as an accelerator & invest in very early-stage startups. It aims to disrupt idea stage funding in India by providing initial capital of $100K with further committed capital for deserving portfolio companies. The accelerator VC will fund 100+ early-stage startups in 3 years.,VC,"['Early Revenue', 'Scaling', 'Prototype', 'Idea or Patent']",100000,2000000
Venture Catalysts,https://venturecatalysts.in/,"2nd Floor, B – Wing, Mittal Commercia, Behind JW Marriott, Andheri – East, Mumbai, Maharashtra 400059, IN","We invest across sectors. Venture Catalysts is creating the world's largest community driven integrated incubator that supports startups across its lifecycle with a combination of capital, knowledge & network. Having started in 2016, Venture Catalysts has been India's top ranked early stage startup investor for 5 years running, and has featured amongst the world's top 3 early stage investors for the last 2 years.

Venture Catalysts is an integrated incubator which invests USD 200k - 2Mn in capital and provides a combination of mentoring and support to the startups. Besides being India's leading investor, Venture Catalysts has gone on to become one of the World's Most Active Investors in the last few years",Angel network,"['Early Revenue', 'Scaling', 'Growth', 'Pre-IPO']",100000,2000000
Beams Fintech Fund,https://beams.vc/,"Mumbai, India","We Invest in companies operating at the intersection of Financial Services & Technology. Beams Fintech Fund is India’s 1st Growth Stage (Series B & C) Focussed Fintech Private Equity Fund. Our Fund will create a concentrated portfolio of 10-12 investments by investing $10 -$12 Mn in high-quality Fintech founders & companies in their Series B & C rounds ($100-500 Mn EV). We follow a thesis-driven approach towards investments & have narrowed it down to the following themes for the Fund: Embedded Finance, Platforms & Technologies for the Incumbents or Disrupting the Incumbents, Global Enterprises SAAS, Open Banking & Digital Financial Inclusion.",VC,"['Pre-IPO', 'Scaling', 'Growth']",7000000,12000000
Aperitivo,https://aperitivo.vc,"Avinguda Diagonal, 606, 08021 Barcelona",We invest in Worldwide startups from 0 to 1. Sector Agnostic.,VC,"['Idea or Patent', 'Prototype', 'Early Revenue', 'Scaling', 'Growth', 'Pre-IPO']",50000,5000000
Canaan,https://www.canaan.com/,"2765 Sand Hill Road, Menlo Park, CA 94025","We invest in early-stage startups across multiple sectors:  Enterprise, Consumer, Fintech & Frontier from seed to Series B.",VC,"['Prototype', 'Early Revenue', 'Scaling']",500000,20000000
Prepare 4 VC,http://prepare4vc.com,"100 State Street, FL 11, Boston, MA 02109","Our focus is on turning great founders into great leaders of growing startup ventures. We set goals with you at the beginning of the program with the aim of achieving your 12 month milestones in 12 weeks through educational programming, cohort based brainstorming and sharing, and accelerated introductions to partners, investors, and mentors who can turn ideas into action.","Incubator, Accelerator","['Prototype', 'Early Revenue']",0,0
Superbet Ventures,https://www.superbetgroup.com,"38 Warren Street, London, England W1T 5LA, GB","We invest at the intersections of sport, entertainment, betting, gaming, crypto & web3.

",Corporate VC,"['Prototype', 'Early Revenue']",100000,1000000
Dheeraj Sidana,https://www.dksidana.com,"Delhi, India","I invest in SAAS, India/US",Solo angel,"['Idea or Patent', 'Prototype', 'Early Revenue']",1000,50000
Blockchain Founders Fund,https://blockchainff.com/,Singapore,"We invest in pre-seed to seed stage, blockchain, crypto, and web3 startups. We seek companies early, under $25M in valuation. ",VC,"['Idea or Patent', 'Prototype', 'Early Revenue', 'Scaling']",200000,1000000
Randev Ventures (Family Office),https://www.randevventures.com,"Dubai, United Arab Emirates","We invest in B2B Emerging technology, Deeptech, SaaS, Cleantech, and Web3. We invest across India, MENA, North America and SEA. ",Family office,"['Prototype', 'Idea or Patent', 'Early Revenue', 'Scaling']",50000,1000000
Pentathlon Ventures,https://pentathlon.vc/,"Pune, India",We invest in Seed stage B2B SaaS companies with at least USD 100k of ARR.,VC,['Early Revenue'],350000,1000000
Great Eagle Holdings,https://www.greateagle.com.hk/,"33/F, Great Eagle Centre, 23 Harbour Road, Wanchai, Hong Kong","We invest invest in early stage Seed to Series B.

We are sector agnostic, for example we invest in Deep Tech, Semiconductors, Hard Tech, Robotics, Biotech, Life Sciences, Fintech, Software & Internet (e.g. SaaS, Cybersecurity, Ecommerce), AI, Logistics, Proptech, Edtech, Foodtech, Cleantech, Gaming, Consumer & Retail, ConstrucTech, Medical Devices",Corporate VC,"['Idea or Patent', 'Prototype', 'Early Revenue', 'Scaling', 'Growth', 'Pre-IPO']",1000000,4000000
Fintech Next,https://www.fintechnextventures.com/,1968 S. Coast Hwy #3164 Laguna Beach CA 92651,"We invest in fintech, ecommerce and payments",Angel network,"['Early Revenue', 'Scaling']",25000,150000
LvlUp Ventures,https://www.lvlup.ventures/,"555 E 5th St. Los Angeles, California 90013, US",We invest in startups with early traction (industry-agnostic),Corporate VC,"['Idea or Patent', 'Prototype', 'Early Revenue']",200000,1000000
30N Ventures,https://30n.vc,"Santiago, Chile","We invest in:

Stages 
Late Seed, Series A.

Sectors
- Fintech: Transforming the financial landscape with new models and technologies.
- Foodtech: Shaping the future of food production, distribution, and consumption.
- Retail: Revolutionizing e-commerce, marketplaces, and logistics for a seamless customer experience.",VC,"['Early Revenue', 'Scaling', 'Growth']",300000,5000000
First Stage Labs,https://fslabs.io/,"Boulevard Plaza, Dubai, UAE",We invest in web3 companies building products for mass adoption targeting 1M MAU on TON Blockchain,VC,"['Prototype', 'Early Revenue', 'Idea or Patent']",100000,2000000
Inuka Capital,https://inuka.vc,"Singapore, Singapore",We invest in companies that rely on product to drive early growth and network effects,VC,"['Idea or Patent', 'Early Revenue', 'Prototype']",100000,500000
3one4 Capital,https://www.3one4capital.com,"Office #1, 5th Floor, 1 Sobha 50, St Mark's Rd, Ashok Nagar, Bengaluru, Karnataka 560001","We invest in SaaS, Enterprise & SMB Automation, Fintech, Consumer Internet, and Digital Health, with a focus on areas such as machine-driven actionable intelligence services, digital media, ambient intelligence technologies, logistics and distribution, and climate and sustainability tech.",VC,"['Prototype', 'Early Revenue', 'Scaling']",100000,5000000
Bangchak Initiative and Innovation Center,https://www.bangchak.co.th/en/greenovation/biic,"2098 M Tower Building, 8th Floor, Sukhumvit Road, Phra Khanong Tai, Phra Khanong, Bangkok 10260 Thailand","We invest in Cleantech / ClimateTech / Sustainability, hydrogen, green molecules, CCUS, biosciences -(therapeutics, diagnostics, and devices, sustainability and synthetic biology) along with ideas that could help accelerate net zero with radical, cutting edge ideas and technology.

",Corporate VC,"['Prototype', 'Early Revenue', 'Scaling']",500000,5000000
Expert Dojo,https://expertdojo.com/,"395 Santa Monica Place, Santa Monica, CA 90405, United States","We invest in Fintech, IoT, BioTech, Health Care, Healthtech, SaaS, web3, Decarbonization, CPG, Software, Tech.","Incubator, Accelerator","['Early Revenue', 'Scaling', 'Growth']",25000,100000
Sketchnote Partners,https://www.crunchbase.com/organization/sketchnote-partners/recent_investments,"Madrid, Spain","We invest in SaaS, Fintech, Agritech, Logistics, Edtech.

Our thesis is simple. We look for:
- amazing founders
- early signs of product-market-fit
- a strong lead investor. We are always followers, we do not lead",VC,"['Early Revenue', 'Prototype']",50000,250000
Genius X,https://www.genius-x.co/,"Bösch 73, 6331 Hünenberg/ZG, Switzerland.","We accelerate early stage startups in blockchain, crypto, and web3 sectors that are nearly MVP-ready, by providing services around tech development, marketing & community building, token design and tokenomics, fundraising / investor connection, and token sale via our launchpad.","Incubator, Accelerator","['Prototype', 'Early Revenue', 'Scaling']",0,100000
Function Ventures,https://www.functionventures.com/,"New York, NY","We accelerate companies primarily in Fintech and Commerce tech domains. These include payments, lending, crypto and blockchain/web3, regtech, cybersecurity, banking and neo-banking, loyalty, data and analytics, marketplaces, merchant ops, among others. We support portfolio companies by giving them access to an advisory network of C-level executives and successful entrepreneurs, high quality tech development (and other services), and an investor community.",Startup studio,"['Scaling', 'Early Revenue', 'Growth', 'Prototype', 'Pre-IPO']",10000,300000
Campus Fund,https://www.yourcampusfund.com/,"Bangalore, Karnataka, India","We invest in Fintech, IoT, Web3, SaaS, AI, B2B, ",VC,"['Prototype', 'Early Revenue']",50000,100000
Seraphim Space,https://seraphim.vc/,"1 Fleet Place, London, EC4M 7WS","We invest in Space, DeepTech, IoT, AgTech, AI, Analytics, ClimateTech/CleanTech, DeepTech, Hardware, Insurance, IoT, Smart, Cities/UrbanTech, from Series A to growth stage companies.",VC,"['Early Revenue', 'Growth', 'Pre-IPO', 'Scaling']",250000,25000000
Strategic Group,https://www.strategicgroup.ca/venture-capital,"630 8 Ave SW, Calgary, AB, T3G 4C7, Canada",We invest in Founders and companies solving real problems in our world. We are looking for true disruptors and not incremental solutions.,Family office,"['Idea or Patent', 'Prototype', 'Early Revenue', 'Scaling']",25000,100000
Pegasus India Evolving Opportunities Funds,https://www.pegasusfininvest.com/,"Olympia building, Technology St, Hiranandani Gardens, Mumbai, India","We invest in cleantech, Edutech, fintech, cleantech",VC,"['Scaling', 'Growth', 'Pre-IPO', 'Early Revenue']",100000,500000
Summit Works,https://www.summitworks.co/,29 C Douglas Avenue Stamford CT 06906,"We invest in early-stage Agritech, Fintech, Deeptech, B2B tech, SAAS, Environment Tech, EV, and Climate tech startups based in India and USA. The average ticket size is $500K",VC,"['Idea or Patent', 'Prototype', 'Early Revenue', 'Scaling', 'Growth']",500000,500000
Tremis Capital,https://www.tremis.in/,"N138, Panchsheek Park, New Delhi","We invest in fintech, web3, SaaS, blockchain, gaming, health tech, enterprise tech, consumer internet, marketplaces with 50k to 5 Mn ARR. We prefer to never lead a round, and co-invest with the lead investor on similar round terms.",Angel network,"['Early Revenue', 'Prototype', 'Scaling']",50000,250000
Ritesh Lalwani,https://www.ekosystem.company,UAE,"I invest in businesses with a practical business plan, demonstrated PMF and solid founder / founding team. I am sector agnostic. Check out some of my investments on www.ekosystem.company",Solo angel,"['Early Revenue', 'Scaling']",1000,50000
Ilina Rai Sia,https://www.ilinaraisia.com,Singapore,"I invest in startups utilizing novel technologies to solve planetary health issues. This includes climate change, but also more overlooked segments tackling biodiversity loss, pollution and resource scarcity.",Solo angel,"['Idea or Patent', 'Prototype', 'Early Revenue']",1000,100000
Future Planet Capital,https://futureplanetcapital.com/,6 Stratton StLondon W1J 8LD,"We invest in high growth potential companies from the world's top research centres. We provide venture and growth funding to entrepreneurs and businesses profitably solving the world's greatest challenges in Climate Change, Education, Health, Sustainable Growth & Security. ",VC,"['Idea or Patent', 'Prototype', 'Early Revenue', 'Scaling', 'Growth']",25000,3000000
Nexus Venture Partners,https://nexusvp.com/,"3000 Sand Hill Rd Building 1, Suite 260, Menlo Park, CA 94025","We invest in sector agnostic companies and lead or co-lead deals in AI, fintech, open source, SaaS, Enterprise, Deep tech etc. to back outlier software companies globally",VC,"['Idea or Patent', 'Prototype', 'Early Revenue', 'Scaling', 'Growth']",100000,10000000
Cornerstone Venture Partners Fund ,https://www.csvpfund.com/,"Andheri Kurla Road, Chakala, 1107, A wing, Mumbai, Maharashtra 400093., IN",We invest in B2B SaaS companies with $1mn+ ARR ,VC,"['Early Revenue', 'Scaling', 'Growth']",500000,3000000
Artichoke Capital,https://www.artichoke.capital,"309 Ugland House, Grand Cayman, Cayman Islands","We invest in web3 - the combination of the digitization of assets via blockchain tech, and other parallel technologies like AI (ie automation). We look for founders who have domain expertise in the verticals that they’re trying to apply tech solutions to. We are early stage (pre-seed to series A) investors.",VC,"['Early Revenue', 'Prototype', 'Idea or Patent']",100000,500000
Rajat Parikh,https://www.linkedin.com/in/rajat-parikh-0848b488/,India,I invest in Non Negative Unit Economics,Solo angel,"['Idea or Patent', 'Prototype', 'Early Revenue']",1000,500000
CreedCap,https://www.creedcapasia.com/,Bangalore,"We invest in Consumer , SaaS, CleanTech, HealthTech",Family office,"['Early Revenue', 'Scaling']",200000,1500000
Sunicon Ventures,https://www.sunicon.in,"303, Kumar Plaza, Near Kalina Market, Kalina Kurla Rd, Santacruz East, Mumbai, Maharashtra 400029","We invest in industries including but not limited to Agritech, AI, AR, Biotech, Blockchain, D2C, SaaS, Supply Chain, VR, Web3.",VC,"['Prototype', 'Early Revenue', 'Scaling']",100000,400000
Core91 VC,https://core91.vc,"Mumbai, India",We invest in B2b SaaS startups generally before they’ve hit $1M ARR,VC,"['Idea or Patent', 'Prototype', 'Early Revenue']",50000,350000
Save the Children Global Ventures,https://scgv.org/,"33 Lincoln Square South, Carlton, VIC 3053, Australia","We invest in scalable solutions (SaaS, fintech, healthtech, agtech, regtech) startups addressing the problems and populations served by Save the Children's body of work: ECD through secondary education, child & maternal health, climate adaptation, financial inclusion, advocacy, fundraising.",VC,"['Scaling', 'Growth', 'Early Revenue']",150000,500000
BimTek Group,https://bimtek.co.in/,"Delhi, India","We invest in Real Estate, Infrastructure, Consumer Tech",Family office,"['Pre-IPO', 'Growth']",10000000,15000000
Sinarmas Technology,http://www.sinarmas.com,"Bangalore, India","We invest in pre-Seed to Series-B stage, with preferred business models being platforms (aggregators, marketplaces, etc.), SaaS and deep-tech. Within these models, fairly sector-agnostic and comfortable with B2B as well as B2C. Software, asset-light, and highly scalable models are the favorites. ",VC,"['Early Revenue', 'Scaling', 'Growth', 'Prototype']",200000,10000000
Fidelity International Strategic Ventures,https://fisv.com/,"4 Cannon Street, London EC4M 5AB",We invest in Fintech strategic to Fidelity International,VC,"['Scaling', 'Early Revenue', 'Growth']",3000000,15000000
Miracleplus (Former Y-Combinator China),https://www.miracleplus.com/en/,"Haidian district, Chengfu Road, Beijing, CN",We accelerate startups across all verticals and geographies from ideation to Series B,"Incubator, Accelerator","['Idea or Patent', 'Prototype', 'Early Revenue', 'Scaling', 'Growth']",300000,12000000
Crypto Kingdom Ventures,https://cryptokingdom.ventures/,55 Doha Road - Al Qusais 1 - Dubai - UAE,We invest in projects that solves real world problems using blockchain technology. We prefer DeFi projects,VC,['Early Revenue'],10000,75000
big_bets,https://bigbets.tech/,"São Paulo, Brasil",We invest in founders trying to create the largest tech companies of the next generation.,VC,"['Idea or Patent', 'Prototype', 'Early Revenue']",300000,2000000
Striking Markets,https://striking.markets/,"The Hague, Netherlands","We invest in FinTech, blockchain, entertainment and the creator economy. We invest in early stage; pre-seed, seed and series A. We target investments <$20MM post-money valuation with traction.",Angel network,"['Prototype', 'Early Revenue']",10000,100000
JT ventures,https://www.linkedin.com/company/jtventures/,"No. 302, 3rd Floor, Wing - 1 Block, HM Tech Park, Prashanth Extension, Whitefield Main Road, Bangalore, Karnataka 560066, IN",We invest in Disruptive innovation,Family office,['Early Revenue'],50000,250000
Cisco Climate Commitment,https://www.cisco.com/c/en/us/about/csr/climate-impact-regeneration.html,"Cisco Systems, Inc. 170 West Tasman Dr. San Jose, CA 95134 USA","We invest in climate solutions across ClimateTech, IoT, CleanTech, AgTech, Regenerative Agriculture, Carbon, EnergyTech, Urban, Cities, and Circular Economy.",Corporate VC,"['Idea or Patent', 'Prototype', 'Early Revenue', 'Scaling']",200000,2000000
OM DAO Ventures,https://omdao.vc/,"5830 East 2nd St. #94700 Casper, WY 82609 USA","We invest in web3. Currently, our primary focus lies in supporting promising web3 initiatives at the pre-seed and seed stages. We have a keen interest in projects within the DeFi, Gaming, and Infrastructure sectors, which top our priority list. ",VC,"['Prototype', 'Early Revenue', 'Scaling', 'Growth']",30000,300000
Critical Ventures,https://www.critical-ventures.com/,"Parque Industrial Do Taveiro, Lt. 48, Taveiro, Coimbra","We invest in IoT, Web3, fintech, AI, ML, DevOps, Blockchain... from seed to series B",VC,"['Scaling', 'Early Revenue', 'Prototype', 'Idea or Patent']",250000,3000000
Frontierspace Ventures,https://www.frontierspacevc.com/,"Neb Sarai , New Delhi, India",We invest in startups with good revenue growth and a top tier VC on the cap table/leading the round,VC,"['Early Revenue', 'Scaling', 'Growth']",100000,1000000
Sahith Aula,https://medium.com/@sahitha,"New York, New York","I invest in Pre-Seed and Seed Emerging Markets Fintech

While I'm focused on emerging markets fintech, I also consider non-fintech companies where embedded finance has the potential to be 25%+ of the revenue.

Evidence of early-traction and SAM are important in my analysis. SAM = # of viable customers x annual customer value.",Solo angel,"['Idea or Patent', 'Prototype', 'Early Revenue']",5000,50000
I XCEL Ltd,https://ixcel.co/,"U1, Reynard Way, London, TW8 9GD United Kingdom",We invest in businesses and founding teams with significant potential to grow and create value through socio economic activities with early cash flows.,Startup studio,"['Idea or Patent', 'Prototype', 'Early Revenue', 'Scaling', 'Growth', 'Pre-IPO']",25000,100000
Telah,https://telah.vc/,"19 Avenue d'Italie, 75013 Paris, France","We invest in innovative internet companies (Web3, Blockchain, Consumer, VR, games)",Angel network,"['Prototype', 'Idea or Patent', 'Early Revenue', 'Scaling']",150000,300000
Aperio Partners ,https://aperio.partners,B-19 Ganesh Bhavan Tulsi Pipe road Mumbai ,"We invest in companies across consumer tech, fintech, healh tech, mobility/logistics, and SaaS, deeptech etc.",VC,"['Early Revenue', 'Scaling']",150000,450000
FundL Ventures,https://fundl.ventures/,"2F Nittochi Building, 1-4-1 Kasumigaseki, Chiyoda-ku, Tokyo 100-0013","We invest in cleantech, climatetech, renewable energy, EV, agritech and other sectors that yield a positive social impact.",VC,"['Idea or Patent', 'Prototype', 'Early Revenue']",135000,1500000
Colopl Next,https://www.coloplnext.co.jp/?lang=en,"Japan, 〒107-0052 Tokyo, Minato City, Akasaka, 9 Chome−7−2 6F Midtown East",We invest in anything that provides real-life entertainment.,Corporate VC,"['Early Revenue', 'Scaling', 'Growth', 'Pre-IPO']",100000,5000000
sandstorm.vc,https://sandstorm.vc/,"Burj Khalifa Boulevard, Dubai, UAE","We invest in B2B SaaS, FinTech, HealthTech, Industry 4.0.",Angel network,"['Prototype', 'Early Revenue', 'Idea or Patent']",50000,500000
Huddle Ventures,https://huddle.work/,"WeWork, Two Horizon Center, Gurgaon, Haryana, 122002","We invest in Climate, Consumer, Commerce",VC,"['Idea or Patent', 'Prototype', 'Early Revenue']",500000,1000000
CouchPotato,https://couchpotato.vc,"Bengaluru, India","We invest in SaaS, fintech, future of work, climate tech, dev tools and more. We’re thesis-driven but also founder-focused in our approach.

At Couchpotato, we believe that exceptional founders are the driving force behind transformative companies. Our mission is to empower ambitious entrepreneurs by providing patient capital and hands-on support in the earliest stages of startup journeys.

We invest pre-seed and seed, writing $100K checks as a founder's first outside capital. This enables entrepreneurs to get started and gain momentum without substantial dilution.

In addition to flexible financing, we take an active role in helping de-risk the startup process. Our team of experienced operators advises on growth, product-market fit, hiring key roles, forming partnerships, and raising future rounds.

We leverage our network to connect portfolio companies with advisors, customers, technical talent and follow-on investors. By sharing playbooks and facilitating pilot projects, we help founders avoid common pitfalls.

Our ideal founders are relentless learners who demonstrate grit, creativity and vision. We believe diverse, well-rounded teams outperform those with narrow expertise. Founders we back question assumptions, communicate effectively, and balance passion with pragmatism.

We designed Couchpotato to provide maximum autonomy with accountability. Our founder-friendly terms empower startups to take risks and maintain control. We drive alignment through transparency and only succeed when our portfolio succeeds.

If you are an ambitious innovator ready to take the leap, we want to fund you on your journey. Let’s build the future together, $100K check at a time.",Angel network,"['Idea or Patent', 'Prototype', 'Early Revenue']",10000,100000
Shift Left Ventures,https://shiftleft.ventures,"4100, Spring Valley Road, Suite 270, Farmers Branch, TX. 75244",We invest in B2B.,VC,"['Idea or Patent', 'Prototype', 'Early Revenue']",50000,250000
O2 Angels Network,https://www.o2angels.net,"Noida, India",We invest in Deeptech,Angel network,"['Idea or Patent', 'Prototype', 'Early Revenue', 'Scaling']",50000,500000
1 4 All Group,https://1-4-all.group/,"Building 2, Dubai Silicon Oasis, Dubai, UAE","We invest in all 6 economic sectors: Financial (fintech etc), Consumer (IoT, web3, prop tech food tech etc), Healthcare (longevity, biotech, pharmtech etc), Energy, Mining and Industrials (renewable, energy, mining tech etc), IT and Media (SaaS, platform etc), Infrastructure, Real Estate and Utilities.

Being value investors we look for startups that have realistic valuation ideas and are willing to sufficiently pivot with our help.",Family office,"['Early Revenue', 'Scaling', 'Growth']",100000,14000000
Transition VC,https://transitionventurecapital.com/,"Bangalore, India","We invest in Electric Vehicles, Renewable Energy, Hydrogen, Energy Storage, Carbon, etc. Either enhancing energy effciency or reducing carbon emissions directly/indirectly.",VC,"['Prototype', 'Early Revenue', 'Scaling']",250000,2000000
Cervin Ventures,https://www.cervin.com,"705 Forest Avenue Palo Alto, CA 94301","We invest in enterprise software, data and AI, cybersecurity, DevOps, cloud, and networking.",VC,"['Prototype', 'Early Revenue']",250000,6000000
Fluent Ventures,https://www.fluentvc.com/,"San Francisco, CA, USA","We invest in fintech, commerce and health. Geographic Arbitrage: we look to invest in similar business models across multiple markets. ",VC,"['Early Revenue', 'Scaling', 'Growth']",200000,2000000
NGP Capital,https://www.ngpcap.com/,"418 Florence Street Palo Alto, CA 94301, USA","We invest in early-stage B2B companies from Series A onwards in Europe, the US, Israel, and China within enterprise software, industrial tech, cybersecurity, and infrastructure.",VC,['Early Revenue'],5000000,10000000
SHRMLabs,https://www.shrmlabs.com/,"1800 Duke Street, Alexandria, Virginia 22314, US","We invest in HRTech, workplaceTech and future of work technologies.",VC,"['Early Revenue', 'Scaling', 'Growth']",50000,200000
ISX8 Ventures,https://isx8.com/,"San Mateo, CA 94403, US","We invest in disruptive, product-driven startups within enterprise SaaS, AdTech, MarTech, AI, developer tools, and productivity solutions. We seek companies with a proven business model, demonstrated traction, and existing co-investors or angel support.",Angel network,"['Early Revenue', 'Scaling', 'Growth']",50000,100000
Neil Mehta,https://www.simera.co.uk,London,"I invest in Tech4Good, mobile apps, and/or SaaS innovation for the benefit of local communities around the world, not just for profit purposes.",Solo angel,"['Early Revenue', 'Scaling']",,300000
Indus Equity Partners,https://www.indusequitypartners.com/,"604B Arcadia, 6th Floor, South City - II, Sector 49, Gurgaon - 122018, Haryana, India",We are a Sector Agnostic PE fund.,PE fund,"['Scaling', 'Growth', 'Pre-IPO']",50000000,100000000
Arkstons Capital,https://venture.angellist.com/arkstons-capital/syndicate,"London, United Kingdom","We invest in IoT, Fintech, SaaS, Tech, EdTech across stages",Angel network,"['Pre-IPO', 'Growth', 'Scaling', 'Early Revenue', 'Prototype', 'Idea or Patent']",50000,500000
